Hotel_Address,Additional_Number_of_Scoring,Review_Date,Average_Score,Hotel_Name,Reviewer_Nationality,Negative_Review,Review_Total_Negative_Word_Counts,Total_Number_of_Reviews,Positive_Review,Review_Total_Positive_Word_Counts,Total_Number_of_Reviews_Reviewer_Has_Given,Reviewer_Score,Tags,days_since_review,lat,lng,review_total,review_total_clean,compound,review_tag_vader
53 59 Kilburn High Road Maida Vale London Camden London NW6 5SB United Kingdom,364,11/3/2016,7.1,BEST WESTERN Maitrise Hotel Maida Vale, United Kingdom , The staff were not friendly and the room we were checked into smelled strongly of vomit When we asked to change rooms the staff acted like it was an immense burden and just gave us a new key for a different without smiling or saying anything The rooms are very small ,53,1877, The breakfast was nice ,6,2,5.4,"[' Leisure trip ', ' Couple ', ' Standard Double Room No Window ', ' Stayed 1 night ']",273 day,51.5366053,-0.1919832, The staff were not friendly and the room we were checked into smelled strongly of vomit When we asked to change rooms the staff acted like it was an immense burden and just gave us a new key for a different without smiling or saying anything The rooms are very small  The breakfast was nice ,the staff were not friendly and the room we were checked into smelled strongly of vomit when we asked to change rooms the staff acted like it was an immense burden and just gave us new key for different without smiling or saying anything the rooms are very small the breakfast was nice,-0.1551,Negative
Great Cumberland Place Westminster Borough London W1H 7DL United Kingdom,1190,12/25/2015,7.5,The Cumberland A Guoman Hotel, Greece , No power sockets next to the bed,8,5180, Location,2,1,9.2,"[' Leisure trip ', ' Couple ', ' Standard Double Room ', ' Stayed 7 nights ', ' Submitted from a mobile device ']",587 day,51.514879,-0.1606501, No power sockets next to the bed Location,no power sockets next to the bed location,-0.296,Negative
Wrights Lane Kensington and Chelsea London W8 5SP United Kingdom,1172,7/10/2016,7.8,Holiday Inn London Kensington, United Kingdom ,No Negative,0,5945, location is perfect for exploring London,7,1,10.0,"[' Leisure trip ', ' Couple ', ' Executive Double Room ', ' Stayed 1 night ', ' Submitted from a mobile device ']",389 day,51.499981,-0.1928791,No Negative location is perfect for exploring London,no negative location is perfect for exploring london,-0.296,Positive
26 33 Queens Gardens Westminster Borough London W2 3BE United Kingdom,207,10/5/2015,8.2,Caesar Hotel, United Kingdom ,No Negative,0,1164, It was nicer than expected ,7,6,7.9,"[' Business trip ', ' Solo traveler ', ' Executive Single Room ', ' Stayed 1 night ']",668 day,51.5134603,-0.1833081,No Negative It was nicer than expected ,no negative it was nicer than expected,-0.4588,Positive
K rntnerstra e 18 Eingang Neuer Markt 3 01 Innere Stadt 1010 Vienna Austria,325,9/4/2015,8.6,Austria Trend Hotel Europa Wien, Malaysia ,No Negative,0,3221, location,2,22,10.0,"[' Leisure trip ', ' Couple ', ' Classic Room ', ' Stayed 1 night ']",699 day,48.2062103,16.3710387,No Negative location,no negative location,-0.7096,Positive
4 Broad Court Bow Street Covent Garden Westminster Borough London WC2B 5QZ United Kingdom,294,9/10/2016,8.7,Fielding Hotel, United States of America ,No Negative,0,1271, Really outstanding exceptional staff,5,4,10.0,"[' Leisure trip ', ' Couple ', ' Twin Room ', ' Stayed 3 nights ']",327 day,51.5139315,-0.1219893,No Negative Really outstanding exceptional staff,no negative really outstanding exceptional staff,-0.1548,Positive
30 Jamestown Road Camden London NW1 7BY United Kingdom,418,3/6/2016,8.6,Holiday Inn London Camden Lock, United Kingdom ,No Negative,0,1572, Everything,2,1,10.0,"[' Leisure trip ', ' Couple ', ' Family Room 2 Adults 2 Children ', ' Stayed 1 night ', ' Submitted from a mobile device ']",515 day,51.5404555,-0.1460833,No Negative Everything,no negative everything,-0.7096,Positive
Plaza Paisos Catalans s n Sants Montju c 08014 Barcelona Spain,420,7/26/2017,8.6,Barcel Sants, Portugal , Price It is outrageously expensive for what one gets The fake future atmosphere,14,4379, Location Convenient when you arrive in a late flight and have an early train in the morning or vice versa ,22,1,6.7,"[' Solo traveler ', ' Deluxe Double or Twin Room ', ' Stayed 1 night ']",8 days,41.3798964,2.1412433, Price It is outrageously expensive for what one gets The fake future atmosphere Location Convenient when you arrive in a late flight and have an early train in the morning or vice versa ,price it is outrageously expensive for what one gets the fake future atmosphere location convenient when you arrive in late flight and have an early train in the morning or vice versa,-0.6486,Negative
Largo Augusto 10 Milan City Center 20122 Milan Italy,398,12/16/2016,8.7,NH Collection Milano President, Hong Kong , no bad comment,4,3754, Comfy bed nice balcony with view ,8,2,7.5,"[' Leisure trip ', ' Couple ', ' Superior Double Room ', ' Stayed 2 nights ']",230 day,45.4630685,9.1979367, no bad comment Comfy bed nice balcony with view ,no bad comment comfy bed nice balcony with view,-0.4404,Positive
111 avenue de la Bourdonnais 7th arr 75007 Paris France,178,1/19/2016,8.8,H tel de la Bourdonnais, Australia , no pool,3,1337, location,2,2,9.6,"[' Leisure trip ', ' Couple ', ' Classic Double Room ', ' Stayed 2 nights ']",562 day,48.8550466,2.304583, no pool location,no pool location,-0.296,Negative
Moll de Barcelona WTC Ciutat Vella 08039 Barcelona Spain,666,7/8/2016,8.5,Eurostars Grand Marina Hotel GL, South Africa ,No Negative,0,4559, the staff was very good,6,2,10.0,"[' Leisure trip ', ' Family with older children ', ' 2 rooms ', ' Stayed 1 night ']",391 day,41.371308,2.181698,No Negative the staff was very good,no negative the staff was very good,-0.4033,Positive
1 Waterview Drive Greenwich London SE10 0TW United Kingdom,1258,7/9/2017,9.4,Intercontinental London The O2, United Kingdom ,No Negative,0,4204, Everything,2,2,10.0,"[' Leisure trip ', ' Group ', ' Superior Double or Twin Room ', ' Stayed 1 night ', ' Submitted from a mobile device ']",25 days,51.5024348,-0.0002497,No Negative Everything,no negative everything,-0.7096,Positive
41 Avenue Marceau 16th arr 75016 Paris France,160,11/20/2016,8.2,Elys es R gencia, United Arab Emirates , some of arab people with noisy talking at midnight so we can not sleep,15,1100,No Positive,0,2,8.8,"[' Leisure trip ', ' Family with young children ', ' Superior Double or Twin Room ', ' Stayed 2 nights ', ' Submitted from a mobile device ']",256 day,48.8686434,2.2984054, some of arab people with noisy talking at midnight so we can not sleepNo Positive,some of arab people with noisy talking at midnight so we can not sleepno positive,-0.5609,Negative
K rntner Stra e 32 34 01 Innere Stadt 1010 Vienna Austria,228,7/24/2017,8.5,Austria Trend Hotel Astoria Wien, United Arab Emirates , No A C Room was too too hot and very difficult to sleep ,15,2279, Location,2,1,6.7,"[' Leisure trip ', ' Couple ', ' Comfort Room ', ' Stayed 2 nights ', ' Submitted from a mobile device ']",10 days,48.2044655,16.3702399, No A C Room was too too hot and very difficult to sleep  Location,no room was too too hot and very difficult to sleep location,-0.6115,Negative
Bergara 11 Eixample 08002 Barcelona Spain,434,7/12/2017,8.6,Catalonia Plaza Catalunya, United Kingdom ,No Negative,0,4153, friendly staff modern room no hassle,7,3,9.2,"[' Leisure trip ', ' Couple ', ' Double or Twin Room ', ' Stayed 4 nights ']",22 days,41.3865289,2.1682919,No Negative friendly staff modern room no hassle,no negative friendly staff modern room no hassle,-0.5994,Positive
12 Lancaster Gate Lancaster Gate Westminster Borough London W2 3LG United Kingdom,440,2/15/2016,8.0,Best Western Mornington Hotel Hyde Park, United Kingdom , Nothing,2,2418, Near to the park you could get everywhere underground just round the corner,14,1,10.0,"[' Leisure trip ', ' Couple ', ' Executive Double Room ', ' Stayed 1 night ', ' Submitted from a mobile device ']",535 day,51.5119933,-0.1782794, Nothing Near to the park you could get everywhere underground just round the corner,nothing near to the park you could get everywhere underground just round the corner,0.0,Neutral
Via Augusta 5 08006 Barcelona Spain,92,5/17/2016,8.3,Hotel Balmoral, United Kingdom , location to ctr,4,1023, comfy bed big bathroom,5,1,7.9,"[' Leisure trip ', ' Couple ', ' Interior Double or Twin Room ', ' Stayed 1 night ', ' Submitted from a mobile device ']",443 day,41.3961294,2.1551626, location to ctr comfy bed big bathroom,location to ctr comfy bed big bathroom,0.0,Positive
Apollolaan 2 Oud Zuid 1077 BA Amsterdam Netherlands,419,7/21/2016,8.2,Apollo Hotel Amsterdam, India , 1 WiFi in room was inconsistent 2 TUB WAS VERY SLIPPERY The grab bar for showering should be higher 3 Hotel did not reply my message for shuttle from the airport ,33,2968, Didn t have breakfast there ,7,8,9.2,"[' Family with older children ', ' Standard Room ', ' Stayed 2 nights ', ' Submitted from a mobile device ']",378 day,52.3486098,4.8844292, 1 WiFi in room was inconsistent 2 TUB WAS VERY SLIPPERY The grab bar for showering should be higher 3 Hotel did not reply my message for shuttle from the airport  Didn t have breakfast there ,wifi in room was inconsistent tub was very slippery the grab bar for showering should be higher hotel did not reply my message for shuttle from the airport didn have breakfast there,0.0,Negative
Leidsekade 97 Amsterdam City Center 1017 PN Amsterdam Netherlands,601,2/23/2017,8.5,Hampshire Hotel Amsterdam American, United Kingdom , Bit pricey,3,4032, Balcony with view of canal,6,2,8.8,"[' Leisure trip ', ' Couple ', ' Classic Double Room ', ' Stayed 2 nights ', ' Submitted from a mobile device ']",161 day,52.363889,4.881302, Bit pricey Balcony with view of canal,bit pricey balcony with view of canal,0.0,Neutral
112 boulevard de S bastopol 3rd arr 75003 Paris France,134,7/8/2017,8.3,Best Western Premier Marais Grands Boulevards, New Zealand , noise rooms are small,5,1408, the staff access to metro,6,3,7.5,"[' Leisure trip ', ' Family with young children ', ' Classic Double Room ', ' Stayed 2 nights ']",26 days,48.8687425,2.3541761, noise rooms are small the staff access to metro,noise rooms are small the staff access to metro,0.0,Neutral
Aldwych Westminster Borough London WC2B 4DD United Kingdom,409,8/29/2015,8.4,The Waldorf Hilton, United Kingdom , The worst part of the stay was a leak from the ceiling drenching the bed in a musty yellow liquid which resulted in a slow room change at 0100 The free wifi available in the lobby didn t work ,41,1479, The staff were friendly enough ,7,2,4.6,"[' Leisure trip ', ' Couple ', ' Queen Hilton Guest Room ', ' Stayed 1 night ', ' Submitted from a mobile device ']",705 day,51.5131979,-0.1174504, The worst part of the stay was a leak from the ceiling drenching the bed in a musty yellow liquid which resulted in a slow room change at 0100 The free wifi available in the lobby didn t work  The staff were friendly enough ,the worst part of the stay was leak from the ceiling drenching the bed in musty yellow liquid which resulted in slow room change at the free wifi available in the lobby didn work the staff were friendly enough,0.0258,Neutral
Largo Augusto 10 Milan City Center 20122 Milan Italy,398,8/6/2015,8.7,NH Collection Milano President, Saudi Arabia , Wi FI,3,3754, The staff and the locations,6,21,9.2,"[' Leisure trip ', ' Family with older children ', ' Superior Double Room ', ' Stayed 3 nights ', ' Submitted from a mobile device ']",728 day,45.4630685,9.1979367, Wi FI The staff and the locations,wi fi the staff and the locations,0.0,Neutral
Rossell 265 Eixample 08008 Barcelona Spain,91,4/1/2017,8.9,Hotel Omm, Brazil , Gym facility,3,631, Location Staff ,4,62,9.2,"[' Business trip ', ' Solo traveler ', ' Standard Double or Twin Room ', ' Stayed 4 nights ']",124 day,41.3962468,2.1609551, Gym facility Location Staff ,gym facility location staff,0.0,Neutral
Rembrandtplein 26 36 Amsterdam City Center 1017 CV Amsterdam Netherlands,224,1/20/2016,7.7,NH Amsterdam Schiller, United Kingdom , Breakfast didn t know how to make an omelette,10,1667, Location,2,2,5.8,"[' Leisure trip ', ' Family with older children ', ' Standard Double or Twin Room ', ' Stayed 2 nights ', ' Submitted from a mobile device ']",561 day,52.3657092,4.8966912, Breakfast didn t know how to make an omelette Location,breakfast didn know how to make an omelette location,0.0,Negative
92 Rue Du Cherche Midi 6th arr 75006 Paris France,36,6/17/2017,8.9,Hotel Spa La Belle Juliette, Greece , le petit dejeuner,4,303, Night auditor location,4,6,8.8,"[' Business trip ', ' Solo traveler ', ' Suite ', ' Stayed 1 night ']",47 days,48.8474426,2.3223783, le petit dejeuner Night auditor location,le petit dejeuner night auditor location,0.0,Neutral
Via Santa Radegonda 14 Milan City Center 20121 Milan Italy,15,10/6/2015,8.2,TH Street Duomo, Switzerland , after calling the reception 3times the wlan still didn t work cleanliness ,14,172, 3min walk to the Duomo of Milan,8,2,5.4,"[' Leisure trip ', ' Couple ', ' Superior Double Room ', ' Stayed 2 nights ']",667 day,45.4657568,9.1916674, after calling the reception 3times the wlan still didn t work cleanliness  3min walk to the Duomo of Milan,after calling the reception the wlan still didn work cleanliness walk to the duomo of milan,0.0,Negative
Ferdinand Bolstraat 194 Oud Zuid 1072 LW Amsterdam Netherlands,114,12/8/2015,6.4,Savoy Hotel Amsterdam, Netherlands , Little creatures appeared from outside the wall above our bed A few made it till the bed too ,20,995, Enough Space,3,4,4.2,"[' Leisure trip ', ' Couple ', ' Twin Room ', ' Stayed 1 night ']",604 day,52.3497431,4.8911908, Little creatures appeared from outside the wall above our bed A few made it till the bed too  Enough Space,little creatures appeared from outside the wall above our bed few made it till the bed too enough space,0.0,Neutral
Coram Street Camden London WC1N 1HT United Kingdom,709,2/14/2017,8.2,Holiday Inn London Bloomsbury, United Kingdom , bathroom was a bit small,6,2995, very convenient location,4,3,9.6,"[' Leisure trip ', ' Couple ', ' Standard Double Room ', ' Stayed 3 nights ']",170 day,51.5241248,-0.1258066, bathroom was a bit small very convenient location,bathroom was bit small very convenient location,0.0,Neutral
1 Inverness Terrace Westminster Borough London W2 3JP United Kingdom,1274,12/12/2016,7.7,Grand Royale London Hyde Park, United Kingdom ,No Negative,0,6539, COSY AND UNUSUAL LOOKING HOTEL GREAT LOCATION ,9,6,10.0,"[' Leisure trip ', ' Couple ', ' Superior Double Room ', ' Stayed 1 night ']",234 day,51.5109945,-0.1863417,No Negative COSY AND UNUSUAL LOOKING HOTEL GREAT LOCATION ,no negative cosy and unusual looking hotel great location,-0.0173,Positive
Wurzbachgasse 21 15 Rudolfsheim F nfhaus 1150 Vienna Austria,168,8/19/2016,8.1,Atlantis Hotel Vienna, Germany , Being 4star hotel except breakfast ,7,2823, Breakfast,2,11,3.8,"[' Leisure trip ', ' Family with older children ', ' Standard Triple Room ', ' Stayed 2 nights ', ' Submitted from a mobile device ']",349 day,48.2037451,16.3356767, Being 4star hotel except breakfast  Breakfast,being hotel except breakfast breakfast,0.0,Neutral
100 Cromwell Road Kensington and Chelsea London SW7 4ER United Kingdom,176,1/9/2016,8.7,Crowne Plaza London Kensington, Oman , nothing,2,743, everything,2,18,9.6,"[' Couple ', ' Standard Double Room ', ' Stayed 9 nights ', ' Submitted from a mobile device ']",572 day,51.495179,-0.183827, nothing everything,nothing everything,0.0,Neutral
100 Queen s Gate Kensington and Chelsea London SW7 5AG United Kingdom,541,5/3/2017,8.0,Doubletree by Hilton London Kensington, Italy , The room didn t have cold water,8,2367, Location,2,2,5.8,"[' Leisure trip ', ' Solo traveler ', ' Queen Guest Room ', ' Stayed 2 nights ', ' Submitted from a mobile device ']",92 days,51.4925138,-0.1787917, The room didn t have cold water Location,the room didn have cold water location,0.0,Negative
Via Napo Torriani 24 Central Station 20124 Milan Italy,170,7/25/2016,8.5,Best Western Atlantic Hotel, South Africa , Nothing really,3,1738, Everything especially Location,4,17,8.3,"[' Leisure trip ', ' Couple ', ' Economy Double Room ', ' Stayed 2 nights ']",374 day,45.4830211,9.2033246, Nothing really Everything especially Location,nothing really everything especially location,0.0,Neutral
Bryanston Street Marble Arch Westminster Borough London W1H 7EH United Kingdom,908,1/26/2016,8.5,Amba Hotel Marble Arch, Qatar , cleaning staff,3,3980, location renovation,3,46,8.8,"[' Leisure trip ', ' Group ', ' Deluxe King Room ', ' Stayed 5 nights ']",555 day,51.5144004,-0.1565506, cleaning staff location renovation,cleaning staff location renovation,0.0,Neutral
22 25 Finsbury Square City Islington London EC2A 1DX United Kingdom,461,7/18/2017,9.2,Montcalm Royal London House City of London, Ireland , Nothing,2,1592, Comfiest bed we have ever slept in we overslept ,11,2,10.0,"[' Leisure trip ', ' Couple ', ' Deluxe Double Room ', ' Stayed 2 nights ', ' Submitted from a mobile device ']",16 days,51.5218066,-0.0856081, Nothing Comfiest bed we have ever slept in we overslept ,nothing comfiest bed we have ever slept in we overslept,0.0,Positive
