Hotel_Address,Additional_Number_of_Scoring,Review_Date,Average_Score,Hotel_Name,Reviewer_Nationality,Negative_Review,Review_Total_Negative_Word_Counts,Total_Number_of_Reviews,Positive_Review,Review_Total_Positive_Word_Counts,Total_Number_of_Reviews_Reviewer_Has_Given,Reviewer_Score,Tags,days_since_review,lat,lng,review_total,review_total_clean,compound,review_tag_vader
24 rue de Ponthieu 8th arr 75008 Paris France,203,6/6/2016,8.1,H tel Beauchamps, Brunei , Would love to have English movies as part of their channel as we don t understand French Got lost when we first wanted to find our own room but one of the staffs quickly showed us the way We requested for black themed room and got red instead They made the change quickly without fuss ,57,1463, The bed is amazing Room is cosy Location is great very near to Champ Elysees Very friendly and helpful staffs in the hotel Check in check out was quick and easy Great hospitality Clean modern room The black room is much bigger and better than the red room it is both a standard room Although we stayed next to the street couldn t hear anything from outside The hotel was under renovation when we stayed there and we were quite worried it will be too noisy during our stay but surprisingly it was kept to the minimal and we stayed on 5th Level and we couldn t hear any single thing Awesome Love everything about this hotel Worth the money spent It made our 1st time in Paris experience that much more memorable Thank you Hotel Beauchamps ,139,2,10.0,"[' Leisure trip ', ' Group ', ' Classic Room ', ' Stayed 3 nights ']",423 day,48.87096,2.3091617, Would love to have English movies as part of their channel as we don t understand French Got lost when we first wanted to find our own room but one of the staffs quickly showed us the way We requested for black themed room and got red instead They made the change quickly without fuss  The bed is amazing Room is cosy Location is great very near to Champ Elysees Very friendly and helpful staffs in the hotel Check in check out was quick and easy Great hospitality Clean modern room The black room is much bigger and better than the red room it is both a standard room Although we stayed next to the street couldn t hear anything from outside The hotel was under renovation when we stayed there and we were quite worried it will be too noisy during our stay but surprisingly it was kept to the minimal and we stayed on 5th Level and we couldn t hear any single thing Awesome Love everything about this hotel Worth the money spent It made our 1st time in Paris experience that much more memorable Thank you Hotel Beauchamps ,would love to have english movies as part of their channel as we don understand french got lost when we first wanted to find our own room but one of the staffs quickly showed us the way we requested for black themed room and got red instead they made the change quickly without fuss the bed is amazing room is cosy location is great very near to champ elysees very friendly and helpful staffs in the hotel check in check out was quick and easy great hospitality clean modern room the black room is much bigger and better than the red room it is both standard room although we stayed next to the street couldn hear anything from outside the hotel was under renovation when we stayed there and we were quite worried it will be too noisy during our stay but surprisingly it was kept to the minimal and we stayed on level and we couldn hear any single thing awesome love everything about this hotel worth the money spent it made our time in paris experience that much more memorable thank you hotel beauchamps,0.9963,Positive
372 Strand Westminster Borough London WC2R 0JJ United Kingdom,2288,5/31/2016,8.1,Strand Palace Hotel, United Kingdom , Nothing ,3,9568, Great location room ideal bed comfy Staff were very pleasant ,12,12,10.0,"[' Leisure trip ', ' Couple ', ' Cosy Double Room ', ' Stayed 2 nights ', ' Submitted from a mobile device ']",429 day,51.5110993,-0.1208673, Nothing  Great location room ideal bed comfy Staff were very pleasant ,nothing great location room ideal bed comfy staff were very pleasant,0.5717,Positive
Viale Fulvio Testi 300 Bicocca Zara 20126 Milan Italy,108,9/24/2015,8.5,Starhotels Tourist, Romania , It is pretty difficult to reach it when the metro is not running the hotel is located at the end of a metro line Absolutely no shop nearby if you want to buy something water for example please do it downtown There was a strange persistent unpleasant smell in the room situated on the first floor coming probably from outside Beds towels bathroom were utterly clean but we couldn t contain the smell even with closed windows Sorry for that otherwise the hotel meets high standards ,88,2135, A quality hotel with high standards Friendly staff good breakfast ,12,5,8.3,"[' Leisure trip ', ' Couple ', ' Classic Double or Twin Room ', ' Stayed 3 nights ']",679 day,45.5266395,9.2131549, It is pretty difficult to reach it when the metro is not running the hotel is located at the end of a metro line Absolutely no shop nearby if you want to buy something water for example please do it downtown There was a strange persistent unpleasant smell in the room situated on the first floor coming probably from outside Beds towels bathroom were utterly clean but we couldn t contain the smell even with closed windows Sorry for that otherwise the hotel meets high standards  A quality hotel with high standards Friendly staff good breakfast ,it is pretty difficult to reach it when the metro is not running the hotel is located at the end of metro line absolutely no shop nearby if you want to buy something water for example please do it downtown there was strange persistent unpleasant smell in the room situated on the first floor coming probably from outside beds towels bathroom were utterly clean but we couldn contain the smell even with closed windows sorry for that otherwise the hotel meets high standards quality hotel with high standards friendly staff good breakfast,0.8271,Neutral
Llan 24 Eixample 08015 Barcelona Spain,53,12/4/2016,8.6,Ofelias Hotel 4 Sup, United Kingdom , The temperature in the room was so hot Heating but no air conditioning on ,16,343, Location was very good ,6,1,7.1,"[' Leisure trip ', ' Couple ', ' Double or Twin Room ', ' Stayed 3 nights ', ' Submitted from a mobile device ']",242 day,41.3957584,2.1822402, The temperature in the room was so hot Heating but no air conditioning on  Location was very good ,the temperature in the room was so hot heating but no air conditioning on location was very good,0.359,Positive
7 Pepys Street City of London London EC3N 4AF United Kingdom,1936,7/30/2017,8.7,DoubleTree by Hilton Hotel London Tower of London, United Kingdom , Key cards kept stopping working drinks in the bar very overpriced and service charge added onto everything The Natural restaurant is also very overpriced and food not that good Far better food and drink available only a short walking distance away,42,7491, Perfect location for seeing the sights and secure underground parking was a bonus although cost 30 per night,19,4,7.1,"[' Leisure trip ', ' Couple ', ' Queen Room Mobility Access ', ' Stayed 1 night ']",4 days,51.5108412,-0.0780581, Key cards kept stopping working drinks in the bar very overpriced and service charge added onto everything The Natural restaurant is also very overpriced and food not that good Far better food and drink available only a short walking distance away Perfect location for seeing the sights and secure underground parking was a bonus although cost 30 per night,key cards kept stopping working drinks in the bar very overpriced and service charge added onto everything the natural restaurant is also very overpriced and food not that good far better food and drink available only short walking distance away perfect location for seeing the sights and secure underground parking was bonus although cost per night,0.8999,Negative
69 Boulevard Victor 15th arr 75015 Paris France,63,9/15/2015,8.5,Mercure Vaugirard Paris Porte De Versailles, United Kingdom ,No Negative,0,843, lovely rooms helpful staff that could speak English and help us with directions right outside metro station close by to main attractions using the metro,26,1,10.0,"[' Leisure trip ', ' Couple ', ' Standard Double Room with Sofa ', ' Stayed 3 nights ', ' Submitted from a mobile device ']",688 day,48.8330649,2.2879617,No Negative lovely rooms helpful staff that could speak English and help us with directions right outside metro station close by to main attractions using the metro,no negative lovely rooms helpful staff that could speak english and help us with directions right outside metro station close by to main attractions using the metro,0.7351,Positive
335 337 High Street Stratford Newham London E15 2TF United Kingdom,293,8/30/2016,9.0,The Westbridge Hotel, United Kingdom ,No Negative,0,1200, The bed was superb and the air con a dream to operate,13,1,10.0,"[' Leisure trip ', ' Couple ', ' Standard Double Room ', ' Stayed 1 night ']",338 day,51.5373904,-0.0023367,No Negative The bed was superb and the air con a dream to operate,no negative the bed was superb and the air con dream to operate,0.0516,Positive
1 3 Queens Garden Westminster Borough London W2 3BA United Kingdom,1058,4/4/2016,7.7,The Park Grand London Paddington, United Kingdom ,No Negative,0,4380, Very kind and helpful staff great service 5 ,10,2,10.0,"[' Business trip ', ' Solo traveler ', ' Deluxe Double Room ', ' Stayed 2 nights ', ' Submitted from a mobile device ']",486 day,51.5142184,-0.1809032,No Negative Very kind and helpful staff great service 5 ,no negative very kind and helpful staff great service,0.7146,Positive
50 Lancaster Gate Westminster Borough London W2 3NA United Kingdom,417,1/16/2017,6.7,Commodore Hotel, Germany , The mattress was quite worn A new one is badly necessary For the next one it might be clever to use a mattress cover to expand the lifespan of the mattresses As our room was in the basement we cleary heard the underground trains passing the hotel If you are very sensitive to noises you shall mention this before ,61,2400, The location is excellent right at the Hyde Park and within walking distance to Paddington station Lancaster Gate Bus stop is also nearby Staff was very nice and polite and helpful We even got an better room than we have booked We loved the look of the Lobby area Very nice to come in after a long and cold day in the city and sitting in front of the fire ,72,13,8.8,"[' Leisure trip ', ' Couple ', ' Double Room ', ' Stayed 2 nights ']",199 day,51.5124496,-0.1795215, The mattress was quite worn A new one is badly necessary For the next one it might be clever to use a mattress cover to expand the lifespan of the mattresses As our room was in the basement we cleary heard the underground trains passing the hotel If you are very sensitive to noises you shall mention this before  The location is excellent right at the Hyde Park and within walking distance to Paddington station Lancaster Gate Bus stop is also nearby Staff was very nice and polite and helpful We even got an better room than we have booked We loved the look of the Lobby area Very nice to come in after a long and cold day in the city and sitting in front of the fire ,the mattress was quite worn new one is badly necessary for the next one it might be clever to use mattress cover to expand the lifespan of the mattresses as our room was in the basement we cleary heard the underground trains passing the hotel if you are very sensitive to noises you shall mention this before the location is excellent right at the hyde park and within walking distance to paddington station lancaster gate bus stop is also nearby staff was very nice and polite and helpful we even got an better room than we have booked we loved the look of the lobby area very nice to come in after long and cold day in the city and sitting in front of the fire,0.9402,Positive
Gran Via 550 Eixample 08011 Barcelona Spain,167,5/19/2016,8.8,Hotel Vueling Bcn by HC, United States of America ,No Negative,0,1696, Had a great room at the back of the hotel Staff were very helpful particularly Sophie is great Lots of restaurant within the walking distance,26,3,8.8,"[' Leisure trip ', ' Couple ', ' Twin Room ', ' Stayed 5 nights ']",441 day,41.3831641,2.1604736,No Negative Had a great room at the back of the hotel Staff were very helpful particularly Sophie is great Lots of restaurant within the walking distance,no negative had great room at the back of the hotel staff were very helpful particularly sophie is great lots of restaurant within the walking distance,0.7501,Positive
Lancaster Gate Westminster Borough London W2 3LG United Kingdom,452,11/14/2015,7.6,Corus Hotel Hyde Park, Malaysia , The pillow is hard and not fuffy at all Woke up every morning with stiff neck and shoulder,19,2562,No Positive,0,17,8.3,"[' Business trip ', ' Couple ', ' Executive Double ', ' Stayed 4 nights ', ' Submitted from a mobile device ']",628 day,51.5119446,-0.179939, The pillow is hard and not fuffy at all Woke up every morning with stiff neck and shoulderNo Positive,the pillow is hard and not fuffy at all woke up every morning with stiff neck and shoulderno positive,0.4939,Negative
29 rue Victor Mass 9th arr 75009 Paris France,74,8/23/2016,9.1,Grand Pigalle Hotel, Australia , Saying goodbye the the reception staff,7,399, Placed perfect for everything location location great place to stay recommend to all that come to rome staff cannot do enough for you,24,1,10.0,"[' Leisure trip ', ' Couple ', ' Standard Room Sopi ', ' Stayed 4 nights ', ' Submitted from a mobile device ']",345 day,48.880856,2.3375085, Saying goodbye the the reception staff Placed perfect for everything location location great place to stay recommend to all that come to rome staff cannot do enough for you,saying goodbye the the reception staff placed perfect for everything location location great place to stay recommend to all that come to rome staff cannot do enough for you,0.8834,Positive
100 110 Euston Road Camden London NW1 2AJ United Kingdom,728,7/5/2016,8.9,Pullman London St Pancras, Australia , Somewhat expensive but location is hard to beat ,10,3168, Excellent location in very close walking distance to St Pancras station and Eurostar Staff were very friendly and helpful Breakfast was good with an extensive range of options ,30,21,9.2,"[' Leisure trip ', ' Couple ', ' Classic King Room ', ' Stayed 1 night ', ' Submitted from a mobile device ']",394 day,51.5286766,-0.1283489, Somewhat expensive but location is hard to beat  Excellent location in very close walking distance to St Pancras station and Eurostar Staff were very friendly and helpful Breakfast was good with an extensive range of options ,somewhat expensive but location is hard to beat excellent location in very close walking distance to st pancras station and eurostar staff were very friendly and helpful breakfast was good with an extensive range of options,0.9592,Positive
22 Hertsmere Road Tower Hamlets London E14 4ED United Kingdom,930,4/17/2016,8.9,London Marriott Hotel West India Quay, United Kingdom , TV problems but remedied to my satisfaction ,9,2836, The staff were exemplary ,6,1,8.8,"[' Leisure trip ', ' Solo traveler ', ' Deluxe King or Twin Room ', ' Stayed 1 night ', ' Submitted from a mobile device ']",473 day,51.5072713,-0.0211213, TV problems but remedied to my satisfaction  The staff were exemplary ,tv problems but remedied to my satisfaction the staff were exemplary,0.4588,Positive
Wibautstraat 129 Oost 1091 GL Amsterdam Netherlands,975,2/17/2017,8.7,The Student Hotel Amsterdam City, United Kingdom , It was a tad annoying that we had to get a train from the hotel to the city centre but it was only a few stops and only took 2 minutes but would of liked it to have been a 15 minute walk from the centre however was about 50 minutes 1 hour ,55,7656, The bed was amazing And the curtains were completely black out Staff was very friendly ,17,1,9.6,"[' Leisure trip ', ' Couple ', ' Standard Suite ', ' Stayed 4 nights ', ' Submitted from a mobile device ']",167 day,52.3546649,4.9131641, It was a tad annoying that we had to get a train from the hotel to the city centre but it was only a few stops and only took 2 minutes but would of liked it to have been a 15 minute walk from the centre however was about 50 minutes 1 hour  The bed was amazing And the curtains were completely black out Staff was very friendly ,it was tad annoying that we had to get train from the hotel to the city centre but it was only few stops and only took minutes but would of liked it to have been minute walk from the centre however was about minutes hour the bed was amazing and the curtains were completely black out staff was very friendly,0.9168,Positive
61 Lincoln s Inn Fields Camden London WC2A 3JW United Kingdom,681,6/23/2016,8.9,Club Quarters Hotel Lincoln s Inn Fields, United Kingdom , Never tryed the food so can not comment on that ,12,2692, The staff are lovely and very helpful ,9,1,10.0,"[' Leisure trip ', ' Family with older children ', ' Superior Queen Room ', ' Stayed 2 nights ', ' Submitted from a mobile device ']",406 day,51.5160988,-0.1181749, Never tryed the food so can not comment on that  The staff are lovely and very helpful ,never tryed the food so can not comment on that the staff are lovely and very helpful,0.7841,Positive
30 Leinster Gardens Bayswater Westminster Borough London W2 3AN United Kingdom,1198,8/30/2015,8.5,Blakemore Hyde Park, United Kingdom , For business travellers there should some drinks in the fridge as they might be arriving and leaving soon no time to go out and find just a bottle of water ,32,6596,No Positive,0,13,3.5,"[' Business trip ', ' Solo traveler ', ' Club Single Room ', ' Stayed 1 night ', ' Submitted from a mobile device ']",704 day,51.5129736,-0.1837431, For business travellers there should some drinks in the fridge as they might be arriving and leaving soon no time to go out and find just a bottle of water No Positive,for business travellers there should some drinks in the fridge as they might be arriving and leaving soon no time to go out and find just bottle of water no positive,0.0516,Negative
8 Rue Francois 1Er 8th arr 75008 Paris France,98,1/7/2017,8.4,Residence Du Roy, Egypt , Most staff are not helpful specially night shift except habib hassan and the tunisian lady at the dinning room they tried their best ,25,970, Location,2,1,4.2,"[' Leisure trip ', ' Family with young children ', ' One Bedroom Suite ', ' Stayed 6 nights ', ' Submitted from a mobile device ']",208 day,48.8657687,2.3090386, Most staff are not helpful specially night shift except habib hassan and the tunisian lady at the dinning room they tried their best  Location,most staff are not helpful specially night shift except habib hassan and the tunisian lady at the dinning room they tried their best location,0.4344,Negative
7 Pepys Street City of London London EC3N 4AF United Kingdom,1936,4/5/2016,8.7,DoubleTree by Hilton Hotel London Tower of London, United Kingdom , Hotel charged my card twice bit of invonvenience,9,7491, Roof top bar excellent views of the city Breakfast was nice,12,1,7.1,"[' Leisure trip ', ' Couple ', ' Queen Room ', ' Stayed 2 nights ', ' Submitted from a mobile device ']",485 day,51.5108412,-0.0780581, Hotel charged my card twice bit of invonvenience Roof top bar excellent views of the city Breakfast was nice,hotel charged my card twice bit of invonvenience roof top bar excellent views of the city breakfast was nice,0.7579,Neutral
Muntaner 212 Eixample 08036 Barcelona Spain,79,9/20/2016,8.1,Guitart Grand Passage, Australia , Shower head was always twisted and water ends up on the floor making it very slippery ,18,867, Hotel was in a central location and very clean staff were always helpful Wifi was excellent Our room had been renovated and it looked like they may have been going to start on the passages ,37,12,9.6,"[' Leisure trip ', ' Couple ', ' Comfort Double Room ', ' Stayed 4 nights ', ' Submitted from a mobile device ']",317 day,41.3936071,2.1504611, Shower head was always twisted and water ends up on the floor making it very slippery  Hotel was in a central location and very clean staff were always helpful Wifi was excellent Our room had been renovated and it looked like they may have been going to start on the passages ,shower head was always twisted and water ends up on the floor making it very slippery hotel was in central location and very clean staff were always helpful wifi was excellent our room had been renovated and it looked like they may have been going to start on the passages,0.8999,Positive
45 St Martin s Lane Westminster Borough London WC2N 4HX United Kingdom,338,2/16/2017,9.0,St Martins Lane A Morgans Original, United Kingdom ,No Negative,0,1241, This hotel has it all Believe me when I say you get what you pay for Excellent service facilities and location ,23,4,9.6,"[' Leisure trip ', ' Couple ', ' Superior Queen Room ', ' Stayed 1 night ', ' Submitted from a mobile device ']",168 day,51.5104696,-0.1265824,No Negative This hotel has it all Believe me when I say you get what you pay for Excellent service facilities and location ,no negative this hotel has it all believe me when say you get what you pay for excellent service facilities and location,-0.3818,Positive
6 Hercules Road Lambeth London SE1 7DP United Kingdom,323,1/16/2017,8.8,Park Plaza London Waterloo, United Kingdom , The smart lighting was a bit of a nuisance it kept switching off while we were in the room So having restored the lighting we would have to go to turn off the bathroom light as it was activated at the same time I hate the noise of extractor fans ,52,1489, The location is extremely quiet yet just a short walk from Westminster Bridge You don t hear the sound of the almost constant emergency vehicle sirens nearby The hotel is quiet too Choice of small eateries within a few yards ,42,1,10.0,"[' Couple ', ' Superior King Room ', ' Stayed 2 nights ']",199 day,51.4982412,-0.1134715, The smart lighting was a bit of a nuisance it kept switching off while we were in the room So having restored the lighting we would have to go to turn off the bathroom light as it was activated at the same time I hate the noise of extractor fans  The location is extremely quiet yet just a short walk from Westminster Bridge You don t hear the sound of the almost constant emergency vehicle sirens nearby The hotel is quiet too Choice of small eateries within a few yards ,the smart lighting was bit of nuisance it kept switching off while we were in the room so having restored the lighting we would have to go to turn off the bathroom light as it was activated at the same time hate the noise of extractor fans the location is extremely quiet yet just short walk from westminster bridge you don hear the sound of the almost constant emergency vehicle sirens nearby the hotel is quiet too choice of small eateries within few yards,-0.1639,Negative
53 59 Kilburn High Road Maida Vale London Camden London NW6 5SB United Kingdom,364,7/5/2017,7.1,BEST WESTERN Maitrise Hotel Maida Vale, United Kingdom , Room and area,4,1877, Booked hotel because of its proximity to Wembley Not a particularly good area restaurants nearby ok No window in room and therefore no view and felt like a cave Also smelt mildly of damp Breakfast good,37,3,6.3,"[' Leisure trip ', ' Family with young children ', ' Standard Double Room No Window ', ' Stayed 2 nights ', ' Submitted from a mobile device ']",29 days,51.5366053,-0.1919832, Room and area Booked hotel because of its proximity to Wembley Not a particularly good area restaurants nearby ok No window in room and therefore no view and felt like a cave Also smelt mildly of damp Breakfast good,room and area booked hotel because of its proximity to wembley not particularly good area restaurants nearby ok no window in room and therefore no view and felt like cave also smelt mildly of damp breakfast good,-0.6054,Negative
Prins Hendrikkade 59 72 Amsterdam City Center 1012 AD Amsterdam Netherlands,493,5/17/2016,8.6,NH Collection Amsterdam Barbizon Palace, United Kingdom ,No Negative,0,2865, Staff were very nice,5,4,10.0,"[' Leisure trip ', ' Couple ', ' Superior Double or Twin Room ', ' Stayed 2 nights ', ' Submitted from a mobile device ']",443 day,52.3764175,4.9002201,No Negative Staff were very nice,no negative staff were very nice,-0.4228,Positive
Wiedner Hauptstr 27 29 04 Wieden 1040 Vienna Austria,279,7/2/2017,8.8,Hotel Erzherzog Rainer, India ,No Negative,0,3598, interiors were good,4,3,8.8,"[' Leisure trip ', ' Family with young children ', ' Special Offer Queen Room ', ' Stayed 4 nights ']",32 days,48.1953229,16.3672882,No Negative interiors were good,no negative interiors were good,-0.4588,Positive
